Question,Response,Evaluation
That's great! Can you tell us about a challenging front-end issue you've resolved?,I am a web developer with over 3 years of experience in front-end technologies.,7/10
Impressive! Can you explain how you identified and fixed the issue?,"In my previous role, I was able to successfully debug and fix a complex JavaScript issue that was causing performance problems.",8/10
Excellent. Can you share your experience with responsive design?,I used Chrome DevTools to identify the issue which was a memory leak caused by an unclosed event listener. I fixed it by ensuring the event listener was removed when it was no longer needed.,9/10
Can you tell us about a time when you had to implement a responsive design?,"I have some experience with responsive design, but I'm not very confident in it.",5/10
I see. How about your experience with back-end technologies?,I haven't really had to implement a responsive design before.,4/10
That's fine. Can you tell us about a project where you used Node.js?,"I have some experience with Node.js and Express.js, but I'm more comfortable with front-end technologies.",6/10
I see. How do you usually handle errors in your code?,I haven't really used Node.js in a real project. I've only used it for small personal projects.,3/10
Do you use any error handling libraries or practices?,I usually use console.log to find errors.,2/10
Interesting. Can you tell us about a time when you had to handle a complex error?,"Yes, I use the 'errorhandler' middleware in Express.js for handling errors. It provides a consistent API for handling errors in a Node.js app.",7/10
That's great! How do you ensure the quality of your code?,"In one of my projects, I encountered a complex error related to asynchronous operations in JavaScript. I used async/await and try/catch to handle it.",8/10
Excellent. Can you share your experience with version control systems?,I write unit tests for my code using libraries like Jest. I also use linters and formatters like ESLint and Prettier to maintain code quality.,9/10
Can you tell us about a time when you had to resolve a merge conflict?,"I use Git for version control. I'm comfortable with common Git commands, and I've used GitHub and Bitbucket for remote repository management.",6/10
I see. How about your experience with continuous integration/continuous deployment (CI/CD)?,"Yes, I've resolved merge conflicts in Git. I usually check the conflicting files and decide which changes to keep based on the requirements.",7/10
That's fine. Can you tell us about a project where you used CI/CD?,I have some experience with CI/CD. I've used Jenkins for setting up CI/CD pipelines in one of my projects.,6/10
I see. How do you usually collaborate with other developers in a team?,"In one of my projects, I set up a CI/CD pipeline using Jenkins. The pipeline ran tests and deployed the application to a staging server whenever changes were pushed to the main branch.",8/10
Do you have any experience with Agile methodologies?,I believe in clear communication and collaboration. I use tools like Jira for task management and Slack for communication. I also believe in the importance of code reviews for maintaining code quality.,7/10
That's great! Can you tell us about a challenging data analysis problem you've solved?,I am a data scientist with over 5 years of experience in machine learning and data analysis.,8/10
Impressive! Can you explain how you developed this predictive model?,"In my previous role, I developed a predictive model to forecast sales data which improved the company's strategic planning.",9/10
Excellent. Can you share your experience with big data technologies?,"I used Python libraries like pandas for data manipulation, matplotlib for data visualization, and scikit-learn for building the predictive model.",7/10
Can you tell us about a time when you had to process a large dataset?,"I have some experience with Apache Spark for processing large datasets, but I'm more comfortable with Python and R for data analysis.",6/10
I see. How about your experience with deep learning?,"In one of my projects, I used Apache Spark to process a dataset of over a billion records. It was challenging but I learned a lot from it.",7/10
That's fine. Can you tell us about a project where you used deep learning?,I have some experience with deep learning. I've used TensorFlow and Keras for building neural networks in a few of my projects.,8/10
I see. How do you usually handle overfitting in your models?,"In one of my projects, I used a convolutional neural network (CNN) for image classification. The model achieved an accuracy of over 90% on the test set.",8/10
Do you have any experience with cloud platforms?,"I usually handle overfitting by using techniques like cross-validation, regularization, and early stopping. I also make sure to have a diverse and representative training set.",7/10
That's interesting. Can you tell us about a challenging data analysis problem you've solved?,"I'm a data scientist, but I don't like math.",2/10
Can you explain how you developed a predictive model in a previous role?,"I don't remember, I've done so many things.",1/10
Can you share your experience with big data technologies?,I just use whatever tools are needed. I don't pay much attention to the names.,3/10
Can you tell us about a time when you had to process a large dataset?,I don't like dealing with large datasets. They're too complicated.,2/10
How about your experience with deep learning?,I don't know much about deep learning. It's not my thing.,2/10
Can you tell us about a project where you used deep learning?,I've never used deep learning in a project. It's too complex for me.,1/10
How do you usually handle overfitting in your models?,I don't handle errors. They just happen and I ignore them.,1/10
Do you have any experience with cloud platforms?,I don't use cloud platforms. They're too expensive.,2/10
That's great! Can you tell us about a challenging front-end issue you've resolved?,I am a web developer with over 2 years of experience in front-end technologies.,7/10
Can you explain how you resolved a complex JavaScript issue in a previous role?,"I don't remember, I've done so many things.",2/10
Excellent. Can you share your experience with responsive design?,I used Chrome DevTools to identify the issue which was a memory leak caused by an unclosed event listener. I fixed it by ensuring the event listener was removed when it was no longer needed.,8/10
Can you tell us about a time when you had to implement a responsive design?,I don't like dealing with responsive design. It's too complicated.,3/10
I see. How about your experience with back-end technologies?,"In one of my projects, I implemented a responsive design using CSS media queries. It was challenging but I learned a lot from it.",7/10
That's fine. Can you tell us about a project where you used Node.js?,I don't know much about back-end technologies. I'm more comfortable with front-end technologies.,3/10
I see. How do you usually handle errors in your code?,"In one of my projects, I used Node.js and Express.js to build a RESTful API. It was a great learning experience.",8/10
Do you use any error handling libraries or practices?,I usually ignore errors. They're too annoying to deal with.,2/10